{
  "name": "KRISH BHATIA",
  "role": "Photographer & Videographer",
  "bio": "I photograph and film the mountains, the stillness of nature and the little details most people miss.",
  "location": "New Delhi, India",
  "email": "krish0710bhatia@gmail.com",
  "url": "https://krish-lenss.vercel.app",
  "avatar": "about/profile.jpg",
  "socials": [
    { "label": "Instagram", "url": "https://instagram.com/krish.lenss", "icon": "instagram" },
    { "label": "Behance", "url": "https://behance.net/cd739fb8", "icon": "behance" },
    { "label": "LinkedIn", "url": "https://linkedin.com/in/{{HANDLE}}", "icon": "linkedin" }
  ],
  "home": {
    "heroCount": 6,
    "latestTrips": 6,
    "books": 4,
    "reel": { "video": "triund-2026/flock-loop.mp4", "title": "Triund, Himachal Pradesh" }
  },
  "footer": { "marquee": "Let's make something beautiful" },
  "contact": {
    "subjects": ["Commission", "Collaboration", "Prints", "Other"],
    "replyTime": "Usually replies within 2 days"
  }
}
